{
  "schema_version": "factory-data-v2",
  "items": [
    {
      "id": "iron-ore",
      "kind": "item"
    },
    {
      "id": "copper-ore",
      "kind": "item"
    },
    {
      "id": "raw-coal",
      "kind": "item"
    },
    {
      "id": "water",
      "kind": "fluid"
    },
    {
      "id": "coal",
      "kind": "item"
    },
    {
      "id": "iron-plate",
      "kind": "item"
    },
    {
      "id": "copper-plate",
      "kind": "item"
    },
    {
      "id": "iron-gear",
      "kind": "item"
    },
    {
      "id": "automation-science-pack",
      "kind": "item"
    },
    {
      "id": "logistic-science-pack",
      "kind": "item"
    },
    {
      "id": "py-science-pack-1",
      "kind": "item"
    }
  ],
  "recipes": [
    {
      "id": "process-raw-coal",
      "coefficients": {
        "raw-coal": -1.0,
        "coal": 1.0
      },
      "production_cost": 0.0,
      "energy_required": 1.0,
      "ingredients": [
        {
          "type": "item",
          "name": "raw-coal",
          "amount": 1.0
        }
      ],
      "results": [
        {
          "type": "item",
          "name": "coal",
          "amount": 1.0
        }
      ]
    },
    {
      "id": "smelt-iron-plate",
      "coefficients": {
        "iron-ore": -1.0,
        "iron-plate": 1.0
      },
      "production_cost": 0.0,
      "energy_required": 1.0,
      "ingredients": [
        {
          "type": "item",
          "name": "iron-ore",
          "amount": 1.0
        }
      ],
      "results": [
        {
          "type": "item",
          "name": "iron-plate",
          "amount": 1.0
        }
      ]
    },
    {
      "id": "smelt-copper-plate",
      "coefficients": {
        "copper-ore": -1.0,
        "copper-plate": 1.0
      },
      "production_cost": 0.0,
      "energy_required": 1.0,
      "ingredients": [
        {
          "type": "item",
          "name": "copper-ore",
          "amount": 1.0
        }
      ],
      "results": [
        {
          "type": "item",
          "name": "copper-plate",
          "amount": 1.0
        }
      ]
    },
    {
      "id": "craft-iron-gear",
      "coefficients": {
        "iron-plate": -2.0,
        "iron-gear": 1.0
      },
      "production_cost": 0.0,
      "energy_required": 1.0,
      "ingredients": [
        {
          "type": "item",
          "name": "iron-plate",
          "amount": 2.0
        }
      ],
      "results": [
        {
          "type": "item",
          "name": "iron-gear",
          "amount": 1.0
        }
      ]
    },
    {
      "id": "craft-automation-science-pack",
      "coefficients": {
        "iron-gear": -1.0,
        "copper-plate": -1.0,
        "automation-science-pack": 1.0
      },
      "production_cost": 0.0,
      "energy_required": 1.0,
      "ingredients": [
        {
          "type": "item",
          "name": "iron-gear",
          "amount": 1.0
        },
        {
          "type": "item",
          "name": "copper-plate",
          "amount": 1.0
        }
      ],
      "results": [
        {
          "type": "item",
          "name": "automation-science-pack",
          "amount": 1.0
        }
      ]
    },
    {
      "id": "craft-logistic-science-pack",
      "coefficients": {
        "iron-gear": -1.0,
        "copper-plate": -2.0,
        "logistic-science-pack": 1.0
      },
      "production_cost": 0.0,
      "energy_required": 1.0,
      "ingredients": [
        {
          "type": "item",
          "name": "iron-gear",
          "amount": 1.0
        },
        {
          "type": "item",
          "name": "copper-plate",
          "amount": 2.0
        }
      ],
      "results": [
        {
          "type": "item",
          "name": "logistic-science-pack",
          "amount": 1.0
        }
      ]
    },
    {
      "id": "craft-py-science-pack-1",
      "coefficients": {
        "iron-plate": -1.0,
        "copper-plate": -1.0,
        "coal": -1.0,
        "water": -1.0,
        "py-science-pack-1": 1.0
      },
      "production_cost": 0.0,
      "energy_required": 1.0,
      "ingredients": [
        {
          "type": "item",
          "name": "iron-plate",
          "amount": 1.0
        },
        {
          "type": "item",
          "name": "copper-plate",
          "amount": 1.0
        },
        {
          "type": "item",
          "name": "coal",
          "amount": 1.0
        },
        {
          "type": "fluid",
          "name": "water",
          "amount": 1.0
        }
      ],
      "results": [
        {
          "type": "item",
          "name": "py-science-pack-1",
          "amount": 1.0
        }
      ]
    }
  ],
  "final_demands": {},
  "external_supplies": {
    "iron-ore": {
      "cost": 1.0,
      "capacity": 1000.0
    },
    "copper-ore": {
      "cost": 1.0,
      "capacity": 1000.0
    },
    "raw-coal": {
      "cost": 1.0,
      "capacity": 1000.0
    },
    "water": {
      "cost": 0.0,
      "capacity": 1000.0
    }
  },
  "unmet_demand_penalty_rate": 1000000.0
}
